,exhibition_name,poster_link,exhibition_description,exhibition_place,start_period,end_period,place
203,보이스리스 - 일곱 바다를 비추는 별,https://sema.seoul.go.kr/common/imageView?thumbYn=Y&FILE_PATH=%2Fex%2FEXI01%2F2018%2F&FILE_NM=20180626124419_8ea8d2eae5ad4ead81c467f6c8cd5fd2_f67caf41b99f4bca89d635aebd7ed64e,서울시립미술관의 기획전시 보이스리스 일곱 바다를 비추는 별 은 동시대를 살아가는 우리의 삶 속에서 억압되고 배제된 존재를 조명함으로써 우리를 둘러싼 다양한 영역의 문제에 대해 생각해 볼 수 있는 기회를 마련하고 예술이 지닌 사회적 함의와 가능성을 고민해보는 전시다 오늘날 역사적 사회적 정치적 맥락이 탈각된 채 광범위하고 무차별적으로 사용되는 포스트식민주의 개념은 적어도 서구와 비서구 혹은 제 세계와 세계에서 매우 다른 의미를 지닌다 과거의 역사적 경험이자 집단적 상흔으로서 식민주의는 현재에도 억압과 착취를 위한 지배 행위 및 이념으로서 형태를 바꿔가며 지속되고 있다 그에 대항하는 실천적 담론이자 주체성을 회복하려는 일련의 정신적 활동이라고 볼 수 있는 포스트식민주의는 이 전시에서 현실의 구체적 정황을 참조하는 유동적이고 탄력적인 틀로 작동한다 따라서 이 전시는 포스트식민주의가 내포하고 있는 복합적인 맥락에 대한 인지와 그에 따른 문제의식으로부터 출발하여 모든 억압의 상황에 처해있는 목소리 없는 존재에 대하여 이야기하고자 한다 이른바 하위주체라고 불리는 이들은 다수와 소수 혹은 지배계급과 피지배계급이라는 단순한 이중적 구분에 포섭되지 않으며 어디에도 속하지 못하는 배제된 존재들이다 많은 동시대 작가들이 이러한 존재들의 삶을 다시 읽어내고 이들 스스로 발언할 수 있는 가능성을 모색하기 위한 방법으로서의 예술작업을 수행해 나가고 있다 이 전시는 하위주체에 대한 탐구에 천착해 온 일곱 명의 현대미술작가를 초청하고 이들의 작품세계를 통해서 배제된 자들의 여정을 따라 세상을 다시 읽어내는 방식을 제안하고자 한다 이 전시에 초청된 개별 작품들은 특수한 시공간적 상황 하에서 일어났거나 일어나고 있는 구체적인 사건 혹은 서사에서 출발한다 무엇보다 이 전시는 이야기다 일곱 명의 작가가 사회의 보이지 않는 현실을 담아내고 또 펼처 보이는 가운데 생성되는 작은 이야기들을 관통하는 것은 지역적 정체성과 경험적 특수성을 넘어 반복적으로 세계 도처에서 발생하는 공통된 경험이자 현실에 대한 예술적 통찰이다 그러므로 전시는 또한 공통의 이야기를 만들어가려는 시도다 전시의 서사는 이라크 쿠르디스탄 출신 작가 히와 케이 가 들려주는 한 난민의 이야기에서 출발한다 작가는 가상의 인물을 통해서 혹은 자신의 행적이 기록된 화면을 재구성함으로써 개별 사건 이면에 작동하고 있는 체제와 이념에 대한 비판을 가한다 전시장에 울려 퍼지는 시위 현장의 하모니카 소리를 담은 영상은 예술적 수행과 역사쓰기 사이에서 지금의 예술이 발화해야 할 저항의 논리를 설파한다 배제되고 억압된 역사의 기억을 몸에 새겨온 사람들의 이야기를 담고 있는 새창열림 임흥순 의 작품 자신이 속한 시대와 사회의 현실을 강렬한 시각언어로 담아내는 터키 작가 에르칸 오즈겐 의 작품 역시 초월적인 것이 아닌 구체적인 맥락 속에서 예술적 실천의 가능성을 찾으며 현실의 조건들을 재사유하는 실천적 담론을 이끌어내고 연대를 구축하는 주체의 정치성을 요청한다 새창열림 장서영 이 그려내는 비가시적 존재에 대한 단상 속에는 삶을 추동하는 에너지가 시간성에 의해서 조직화됨을 전제하고 그러한 시간성이 체계와의 관계 속에서 재정립되는 현상이 담겨있다 반복과 순환의 메커니즘 속에서 개별적 신체의 경험이 드러내는 멜랑콜리적 상상력은 제도화된 권력에 의해 배제된 자 것 들이 사라지지 않고 다시 귀환하는 이중적 구조를 작동시킨다 이 구조 안에서 배제된 자 것 들은 재현될 수 없는 방식으로 귀환하며 배제한 자들의 결핍을 드러낸다 의미가 탈구되어버린 빈 공간을 드러내고 타자에게 말을 거는 새창열림 조은지 의 작품은 지식에 의해 성찰되지 않는 틈을 이야기한다 윤리적 행위의 가능성을 탐구하는 새창열림 홍순명 의 작품은 응답하는 능력과 타자에 대한 책임이 동일하게 분절되며 공가능성의 풍경이 가져다주는 존재의 열림을 획득한다 조은지의 영상 혹은 홍순명의 회화 속에는 봉합되거나 지워지지 않는 것들이 도래할 것으로 남아서 이질적인 풍경이 된다 현재와 과거 빛과 어둠이 중첩되는 가운데 새창열림 송상희 의 작품에 타자에 대한 예술적 성찰과 환대의 불 가능성에 대한 질문이 새창열림 그림자 처럼 드리워진다 그렇게 우리에게 낯설고도 친밀한 각각의 이미지들은 미학적 성취와 예술의 사회적 역할 사이에서 진동하고 서로 공명하며 켜켜이 접혀 공통의 이야기를 이룬다 보이스리스 일곱 바다를 비추는 별 은 예술이 지닌 사회적 함의와 가능성을 고민해보는 전시다 동시대의 삶이 처한 특정 상황 속에서 전쟁 난민 여성 죽음 등의 문제를 때로는 직접적으로 때로는 예술적 은유를 통해 풀어내는 각각의 작품은 저마다의 방식으로 체득하고 빚어내는 작가적 태도와 재현의 윤리를 설파함으로써 예술이 지닌 가치와 한계를 질문하고 있다 예술은 무엇을 할 수 있는가 혹은 예술적 실천의 논리에서 파생되는 윤리적 재현의 문제를 어떻게 짊어질 것인가 를 고민하는 이 전시는 결국 재현할 수 없는 것의 재현이라는 예술적 역능으로부터 다른 사유의 가능성을 모색한다는 미학적 기획에 근거하고 있다 이러한 문제의식과 기획의도는 전시가 열리기 한 달 전인 월 일 서울시립미술관과 현대미술학회가 공동으로 개최한 동명의 학술대회를 통해 공유된 바 있다 안소현 이나라 곽영빈의 연구논문 발표와 전시 초청작가 임흥순의 프리젠테이션으로 진행됐던 이 사전학술대회에서 하위주체를 예술의 주제로 다룬다는 것의 모순성에 대한 논의가 이루어졌고 현실에 접속하고 개입하는 예술의 논리에 관한 논쟁적 해석들이 제기되었으며 그와 관련한 미학화 역사화의 시점이 공통의 과제로 인지되었다 타인의 고통이 실체화되지 않고 피상에 머물 때 그것의 재현은 시각적 유미주의로 빠져버릴 수 있다는 아이러니 그것을 관객이 단지 감각적으로 전유하게 되어버리는 상황 그렇게 재난이 예술의 주제로 소비되고 있는 현실에 대한 자각 자체가 이 전시의 태생적 부조리함인 동시에 스스로를 구성해 나가는 중요한 참조점으로 작용했다고 볼 수 있다 삶의 조건과 예술의 재현 불 가능성에 대한 상호참조적 이해 속에서 결국 전시가 공유하고자 하는 것은 예술언어로 불러내는 타자의 목소리다 타자에 대한 공감의 형성으로부터 환대의 공간이 발생할 수 있으며 주체의 복원이 가능해진다 관람객은 다양한 작품을 통해 세계를 읽고 해석하는 예술적 관점들을 수용하는 가운데 어떤 방식으로든 작품이 드러내는 시각에 동참하며 스스로 자신의 역설적 위치를 자문해 보는 계기이자 주체성을 재고하는 기회를 맞게 되기 바란다 전시의 제목 보이스리스 는 세상에서 배제되었기 때문에 보이지도 들리지도 않는 목소리 없는 존재를 의미한다 부제목 일곱 바다를 비추는 별 은 넓은 의미에서 전시와 동일한 주제를 다루고 있는 일본 작가 나나카와 카난의 연작단편소설 제목을 인용했다 이 전시는 배제된 자들이 귀환하는 곳에서 완전한 자유가 생겨날 수 있는 가능성과 재현할 수 없는 것의 재현으로서 예술의 가능성에 대한 각각의 긍정에 기초하고 있다 배제된 존재와 자유에 관계에 대한 이러한 기획의도를 전시의 부제목 일곱 바다를 비추는 별 한글 과 배제된 자들의 귀환 영문 에 각각 담았다,서울시립미술관 서소문본관,2018-06-26,2018-06-26,서울시립미술관 서소문본관
204,유령팔,https://sema.seoul.go.kr/common/imageView?thumbYn=Y&FILE_PATH=%2Fex%2FEXI01%2F2018%2F&FILE_NM=20180505171421_82a306db120a48b19e81929f88e682a9_8e6589516e284a4a9fa5987d142d7de6,서울시립 북서울미술관은 년 월 일부터 월 일까지 유령팔 전을 개최한다 본 전시는 오늘날 작가들의 창작활동의 주요 매체인 가상의 전지적 시 새창열림 점으로부터 현실에서 이미지를 소비하고 재현하는 방법들이 어떻게 연결되어 있는지 전시라는 시공간의 설정을 통해 여러 지점에서 살펴보고자 마련된 전시이다 디지털 환경은 예술가들의 사유와 인지의 과정과 예술가에 대한 정의뿐만 아니라 우리의 일상공간까지 변화시켰다 이는 심혜련이 언급했듯이 디지털 공간이 다른 일상공간 으로 대체되면서 매체에 접속하는 시간이 급증함에 따라 우리가 일상적으로 할 수 있는 거의 모든 일들을 웹 상에서 할 수 있게 되었기 때문이다 이는 아날로그와 디지털을 이분법적으로 구분하지 않는 년대 후반생들의 작품의 형식과 이들의 창작과정을 이해하는 매우 중요한 요소가 되었다 이들에게 주어진 매체의 조건과 환경의 변화는 현실과 창작의 기반이 되는 매체 공간의 경계를 흐림으로써 작품을 구현하기 위해 고려되어야 할 실제적인 수단 작업실의 유무 작품 운송 및 보관 등 과 방법의 소멸로 이어져 현실 구현 즉 기존의 전시 작품의 의미와 작품 제작의 과정 미술관에서 작품을 감상하는 일처럼 일상적이고 반복되어왔던 것들에 대해 다시금 질문하기에 이르렀다 유령팔 은 이처럼 인터넷의 보급과 과학 기술의 발달에 따라 급변하고 있는 창작환경의 변화와 이에 따른 작가들의 작품 구현방식과 그 과정에서 드러나는 새로운 감각과 고민을 살펴보고자 마련되었다 참여작가들은 이번 전시를 통해 그들의 창작 환경의 근간이 된 디지털 기반아래 계정설정 비공간성 신체의 망각과 확장 이라는 구체적인 설정들이 어떻게 작업과 매개하여 구현되는지 선보인다 전시 제목 유령팔 은 사지가 절단된 환자들이 환각을 통해 존재하지 않는 사지의 통증을 느끼는 신체 경험을 뜻하는 환각사지 환각현상 에서 기인한 제목으로 본 전시는 앞서 언급한 매체 변화에 따른 작가들의 창작 환경이 모니터 너머로 확장되면서 그 안과 밖을 연결하는 신체의 동기화 망각 확장에 관한 비가시적인 연결성에 주목한다 이 전시는 이렇듯 급변하는 창작 조건과 환경의 변화를 그들의 작업을 읽기 위한 기본 지식 배경으로 삼고 가상과 현실 사이의 상상적 매핑 새창열림 강정석 안에서 플레이어의 신체 새창열림 김정태 패턴과 기억을 통한 상상적 드로잉 박아람 구글링 이미지 서치와 오류 압축과 팽창 디지털 시대의 기억의 사유화 람한 세컨드 계정과 협업하기 김동희 를 통해 오늘날 전시가 구현되는 방식 작품을 둘러싼 환경과 인식의 변화에 대해 이야기해보고자 한다 심혜련 매체공간의 혼종화와 지각의 확장에 관하여 시대와 철학 온라인 도록,서울시립 북서울미술관,2018-04-03,2018-04-03,서울시립 북서울미술관
205,역사갤러리 특별전 <거울 없는 방 >,https://sema.seoul.go.kr/common/imageView?thumbYn=Y&FILE_PATH=%2Fex%2FEXI01%2F2018%2F&FILE_NM=20180515004138_2118cf57c45f44788096643cbbf981f6_66f4139378e5483c9b776d69461c002d,벙커 역사갤러리는 벙커의 정체성을 보존하고 구축하는 공간이다 서울시립미술관은 이 곳의 역사를 떠올리거나 되짚어볼 수 있도록 관련 자료들을 전시하는 동시에 새롭게 벙커를 대상으로 한 아카이브 프로젝트 영상을 기획하여 선보인다 본 프로젝트를 통해 이 공간을 지속적인 상상과 생산의 장소로 전환해 나가고 단순한 기록보관소의 의미가 아닌 미래에 전념함으로써 도래할 사유를 제공해주는 아카이브적 의미로 채워나갈 수 있기를 기대한다 새창열림 거울 없는 방 은 년에 발견된 벙커의 기록 없음 과 그로 인해 발생한 무수한 추정 에 주목한다 목적성이 사라진 벙커를 기억상실증에 걸린 가상의 무고한 정치범으로 의인화하여 벙커에 다른 어떤 것이 존재하리라고 믿거나 다른 것이 있다고 믿는 척 하며 벙커를 해석하는 우리의 접근 방식 자체에 질문을 던진다 벙커를 감금한 기관은 벙커가 실리적인 목적 없이 그 자체만을 위해 존재 해야 하는 상황을 인정하지 못한다 그러면서도 벙커와 직접적인 관련이 없을 지도 모를 무의미한 기록의 홍수 속에서 자신의 기억 속에 전혀 존재하지 않는 공백의 역사를 그럴듯하게 채워내기를 강요한다 새창열림 손광주 는 아카이브 영상 대한뉴스 과 소리를 이용해 일상적인 의미가 사라져 낯설고 공허한 공간인 벙커가 창조해낸 기억을 묘사한다 그것은 의지를 빼앗긴 삶 폭력적인 시대에 민족 중흥의 역사적 사명을 띠고 이 땅에 태어나야 했던 작가의 유년 기억과도 연결된다 거울 없는 방 은 사회적으로 승인된 사고 방식과 생활방식에 따라 살면서 독자적인 존재와 깊이를 갖지 못하는 우리들의 불안을 첨예하게 드러내며 색다른 시사점을 선사할 것이다,SeMA 벙커,2018-05-03,2018-05-03,SeMA 벙커
206,SeMA 소장작품 기획전 <잃어버린 세계>,https://sema.seoul.go.kr/common/imageView?thumbYn=Y&FILE_PATH=%2Fex%2FEXI01%2F2018%2F&FILE_NM=20180505180939_9cea2f8f54414ea5a58700bb2062fc59_48283d19dae341c687121005d8592e95,잃어버린 세계 는 서울시립미술관이 수집해 온 작품들을 중심으로 현대미술이 자연과 관계 맺어온 태도를 새롭게 연결하고 읽어보고자 한다 특히 절대적인 것에서 유기적이고 맥락적인 체계로 이행하고자하는 동시대의 다양한 실험과 도전들 뿐 아니라 년대 이후 여성적 생명력과 몸의 기억이 만들어낸 치유의 감각들 또 년대 이후 자연과의 몰아적 조응을 보여주는 작가들의 창작태도를 소개한다 이 미술사적으로 특징적인 양상들을 묶어낸 이유는 두 가지이다 첫째는 근대 이후 자연을 정복하고자 했던 주체가 보여주는 정교하고 다양한 사회문화적이면서 실질적인 억압에 대해 타자의식을 가지고 벗어나려했던 시도들이라는 점 두 번째는 외형적으로 흡사하나 그것이 만들어진 내적 논리는 완전히 다른 시각 이미지들의 뿌리를 다시 복기 할 수 있다는 점이다 다양한 사회적 배경 디지털 환경 하에서 변주되는 이미지들과 자연과 신체에 기반한 실제적 이미지들을 비교해 볼 수 있을 것이다 이를 통해 현대미술이 자연을 매개로 보여주는 잃어버린 세계에 대한 대안에 대해 생각할 수 있는 기회가 되기를 기대한다 세 가지 특징적 양상을 구체적으로 들여다보면 다음과 같다 첫째 한국 모노크롬 회화 중 서구의 미니멀리즘 새창열림 개념미술 과는 달리 물질 그 자체보다 작가의 행위와 신체성을 통해 정신과 물질 주관과 객체 자아와 세계간의 이원성을 뛰어넘는 자연과의 합일을 이루고자 했던 작품들이다 둘째 여성적인 사고의 틀을 가진 작품들이다 여성은 역사 이래로 거대한 사회 구조 하에서 주변적 타자로 존재해 왔다 이는 타자로서 자연과의 일체화를 가능하게 했을 뿐 아니라 인간 이성의 우위를 시위하는 기하학적 모더니즘 미술을 넘어 여성적 생명력과 촉각적 감각 보살핌의 윤리를 복권한다 세 번째는 새로운 관점을 바탕으로 합리적 기계론적 세계관에 도전하는 동시대 작품들이다 작가들은 때로는 유사과학적 모델이나 역설적 전형을 수용하여 비현실적 상황 속에 절대적인 기준에 대한 질문을 던지기도 하고 세계를 관찰하고 체계적으로 데이터를 모으는 과학적 방법으로 작업하되 그 밑에 내재된 문화적 가정을 해체하기도 한다 서울시립미술관은 다시 여러분을 잃어버린 세계 에 초대한다 그리고 자연이 우리 삶과 어떻게 연결될 수 있는지 살펴볼 수 있게 되기를 바란다,서울시립 북서울미술관,2018-03-27,2018-03-27,서울시립 북서울미술관
207,관객행동요령,https://sema.seoul.go.kr/common/imageView?thumbYn=Y&FILE_PATH=%2Fex%2FEXI01%2F2018%2F&FILE_NM=20180508203633_186cc4a8e69347d09df07ec94ac25b51_517a98f54037442c94c1cad8c7146ec7,벙커는 년 첫 번째 기획전으로 관객행동요령 전을 선보인다 본 전시는 벙커를 독재의 잔재와 전쟁의 상처로 인식하는 역사적 접근을 의도적으로 외면함으로써 동시대 예술의 언어로 벙커의 차별적 정체성을 확립하고 관람객에게 새로운 예술 접근 경험 기회를 선보이기 위해 기획되었다 년 여의도 버스환승센터 공사 당시 벙커가 발견된 이래로 정황과 추측에 맞닿아 구축되어온 여러 가지 정책으로 인해 대중은 엄폐호 와 같은 개념의 보편적인 인식을 익숙하게 여긴다 하지만 관객행동요령 전은 벙커의 실존적 개념에 집중하며 하나의 지하건축 유토피아로 벙커를 재조명하고자 한다 서울시립미술관은 전시로부터 형성되는 벙커의 유의미성에 집중하면서 궁극적 존재론을 확립하고자 벙커를 지하 의 특성에 국한하여 건축 고고학 문학 환경계획학 심리학 등의 분야가 융합된 시선으로 바라봤다 네안데르탈인 화석과 트로이 유적의 발굴은 땅을 파는 행위를 지적 탐구의 전형으로 해석하게 하는 계기가 되어 지하를 진리의 발견과 연결 짓는다 또한 구제역이나 조류독감 발생 시 모든 원인과 결과를 땅 속에 묻어버리는 것은 지하가 인류에게 주는 심리적 안정감 때문인데 덕분에 지하 구조가 이 시대가 직면한 생태계 파괴와 환경문제의 총아로 떠올랐다 릴레함메르 동계 올림픽 당시 요빅 아이스하키 경기장이 지하로 설계되어 건축된 사례가 그 근거다 지하건축이 전면 등장한 것은 건설 산업의 진보에 긍정적으로 기여한 계기가 되었고 상상과 진리를 넘어 새로운 물질세계의 자원으로 해석되며 근대 의식 측면에서 정당성을 확보해 왔다 선택 받은 자들만이 도피할 수 있는 은밀한 공간으로 읽혀지던 벙커는 이처럼 꽤나 건설적인 배경을 타고났다 철학적으로도 벙커는 병참의 기지나 군사전쟁의 도구로 해석되지만 벙커는 다르다 여의도 버스환승센터에 위치한 벙커는 년도에 이르러 문화 예술 향유의 거점이 되면서 설계 당시 염두에 두지 않았던 이들을 지하로 끌어 내리고 있는데 이 지점에 벙커가 구축할 수 있는 새로운 지하세계 담론이 있다 엮일 수 없는 존재와 관념을 지하건축으로 밀어 넣어 관찰자 각자의 시선을 전복시킴으로써 비판적 거리를 없애 벙커를 초공간 으로 기능하게 하는 것이다 그리고 그곳에 고립된 관람객은 다양한 작품을 마주하며 스스로의 변증법적 사고를 거쳐 각자의 지하 유토피아를 건설하게 될 것이다 전시제목 관객행동요령 은 벙커에서 화재 발생 시 대피와 소화의 절차를 지시하고 안내하는 국민행동요령 에서 왔다 매뉴얼화된 대피 방식을 따라야만 하는 국민과 전시의 완성을 점철해나갈 관객을 명확하게 분리해야 한다는 의지와 더불어 제시된 전시의 좌표를 따라가며 새로운 경험을 할 수 있도록 안내하는 행동요령을 소개하는 전시라는 역설적 의미를 담고 있다 관객행동요령 전은 우리의 역사와 사회를 앎에 한걸음 더 가까이 다가가기 위한 색다른 예술적 접근법을 선언한다 이 문지방을 넘어 벙커를 찾는 관람객 모두가 각자의 예술 언어를 확보할 기회를 가지길 기대한다,SeMA 벙커,2018-05-03,2018-05-03,SeMA 벙커
208,2018 난지미술창작스튜디오 12기 국외입주자 2분기 성과보고전 <Shifting Surfaces>,https://sema.seoul.go.kr/common/imageView?thumbYn=Y&FILE_PATH=%2Fdata%2F2018%2Fmgimg%2Fimg31%2Fkor%2F&FILE_NM=pfile2018_1530254797456.jpg,난지미술창작스튜디오는 국제교류를 위해 국외입주자프로그램과 국제 입주작가 교환프로그램을 운영하고 있습니다 국외입주자 프로그램은 매해 입주신청과 심사를 거쳐 입주작가를 선발하고 매 분기별 입주기간이 끝나는 시기에 맞춰 입주기간 동안의 성과를 보여주는 성과보고전을 개최합니다 난지미술창작스튜디오 기 국외입주자 분기 성과보고전 은 난지 기 분기 입주작가인 브라질 프랑스 레바논 미국 영국 국제교환프로그램 작가 핀란드 스페인 가 지난 개월동안 난지미술창작스튜디오에서 연구하고 작업한 페인트 영상 및 설치작업을 선보입니다 부대행사 개막식 목 오후 시,서울시립 난지미술창작스튜디오,2018-06-21,2018-06-21,서울시립 난지미술창작스튜디오
209,2018 난지아트쇼II <믿음을 구하라>,https://sema.seoul.go.kr/common/imageView?thumbYn=Y&FILE_PATH=%2Fdata%2F2018%2Fmgimg%2Fimg31%2Fkor%2F&FILE_NM=pfile2018_1528699185325.jpg,부대행사,서울시립 난지미술창작스튜디오,2018-06-07,2018-06-07,서울시립 난지미술창작스튜디오
