,exhibition_name,poster_link,exhibition_description,exhibition_place,start_period,end_period,place
129,모던 로즈,https://sema.seoul.go.kr/common/imageView?thumbYn=Y&FILE_PATH=%2Fex%2FEXI01%2F2019%2F&FILE_NM=20191015104300_aa8d93bdc18040fab403ebb7aa88a97a_c98a621a6a404b529a3fab000c8f8918,서울시립미술관은 유서 깊은 건축인 남서울미술관에서 모던 로즈 전시를 개최한다 남서울미술관 건축물은 대한제국기에 세워진 옛 벨기에영사관으로 건립 이후 백여 년의 시간이 지났음에도 본래의 모습을 간직하고 있는 흔하지 않은 근대 서양건축물이다 파란만장했던 한국의 근현대를 겪으면서 세워지고 해체되고 다시 복원되며 지금은 미술관이 된 이 건축물은 다양한 새창열림 시간과 공간 이 공존하는 이질적인 풍경을 만들어 낸다 이로 인해 우리는 미술관 공간에 들어서면 정지된 과거에 들어오는 듯한 향수를 느끼게 된다 이와 같은 심미적 가치는 지금을 만들고 있는 다층적인 현재의 삶과도 맞닿아 있다 모던 로즈 전시는 건축물이 매 기본정보 개하고 있는 심리적 감성의 이면을 들추어 보면서 불완전할 수 밖 에 없는 현재가 담고 있는 다층적인 면모를 사유하고자 한다 모던 로즈 는 세기 초 벨기에영사관에 있었던 장미에 대한 기사에서 연유한 제목이다 일제강점기에 벨기에영사관이 매각되면서 서양에서 온 이 장미들은 당시의 조선호텔 로즈 가든으로 옮겨져 근대적 감성을 향유하는 상징이 되었었다 오늘날 장미는 동양의 월계화가 유럽으로 전해져 올드 장미와 만나서 만들어 진 모던 로즈에서 시작되었다 모던 로즈는 이후 다시 동양에 유입되면서 현재는 우리에게 가장 익숙한 꽃이 되었다 본 전시는 잘 아는 꽃이지만 잘 몰랐던 장미 이야기처럼 남서울미술관 건축에 관한 이야기를 통해 근현대의 복합적인 시간과 만나는 지금의 이야기를 다시 소환한다 모던 로즈 는 명의 작가들이 이번 전시를 위해 새롭게 제작하거나 연출한 작품들로 만들어 진 각각의 독립된 개별 전시다 동시에 남서울미술관 건축에 대한 기록과 기억에서 발굴한 이야기들로 연결되는 옴니버스 소설 같은 구성을 가지고 있다 작가들은 세기 초반 벨기에영사관부터 재개발로 남현동으로 이전된 시대를 지나 현대미술 전시공간이 된 현재 그리고 미래까지의 시대를 넘나들며 기록과 기억들이 작동하는 방식에 대한 예술적 해석을 시도한다 이번 전시에서는 특별히 미술관 다락을 처음으로 개방한다 다락 공간은 미술관이 지나 온 시간과 흔적을 느낄 수 있는 장소로서의 특별한 체험을 제공할 것이다 모던 로즈 전시는 과거와 현재가 어우러지는 현대미술 전시공간인 남서울미술관에서만 만날 수 있는 소중한 경험을 관객에게 선사할 것이다,서울시립 남서울미술관,2019-10-15,2019-10-15,서울시립 남서울미술관
130,석가산의 액션 뮤직,https://sema.seoul.go.kr/common/imageView?thumbYn=Y&FILE_PATH=%2Fex%2FEXI01%2F2019%2F&FILE_NM=20190722112801_0b90c5d12a254dc28ef7d5a3a09e63fa_46e36c1b19d84fc69096133ed6d67e7a,서울시립미술관에서는 년 월 일 새창열림 백남준 탄생 주기를 기념하여 석가산의 액션 뮤직 을 개최합니다 전시가 열리는 백남준기념관은 백남준 의 삶과 예술을 기억하는 집으로 년 발대식을 거쳐 년 개관했습니다 백남준이 유년시절을 보낸 큰대문집 터에 자리 잡은 가옥을 고쳐 만든 이 공간에는 백남준의 예술세계를 탐구하고 그의 예술적 사상적 근간이 되는 연결점을 재구성한 내용들이 여러 형태로 전시되어 꾸준히 관람객을 맞이하고 있습니다 이러한 기념비적 공간에 더해지는 본 전시는 백남준이 살 때부터 년간 살던 옛 집에 관한 아카이브 전시 석가산 과 지역 참여자와 함께 만드는 워크숍 결과물 전시 액션 뮤직 으로 구성된 또 하나의 수행문 입니다 백남준을 둘러싼 기억 을 출발점으로 삼고 있는 이 전시는 예술가 백남준이기 이전에 인간 백남준을 기억하는 사람들 이 주인공이 되어 백남준 예술 세계의 토대가 되는 어린 시절의 공간과 시간의 단면을 새롭게 조명하고 지금 여기로 연결점을 찾고자 합니다 전시 기간 토 토 전시 장소 백남준기념관 서울시 종로구 창신동 종로 길 개막식 토 오후 시 참여작가 서울익스프레스 용녀 박다함 이정성 테크니션 백남준 가족 글로벌 그루브 워크숍 회 토 토 텔레비젼 아트 워크숍 회 월 월 주최 및 주관 서울시립미술관 협력 백남준 가족 백남준을 기리는 사람들 창신동 주민들 석가산 석가산 은 한 때 창신동에서 큰대문집 이라 불리던 백남준의 옛 집에 관한 아카이브 전시입니다 대문이 큰 집의 솟은 지붕을 지나면 너른 마당 한가운데에 석가산 소나무가 심어져 있다 당초문 을 그린 새창열림 붉은 벽 돌을 사이에 둔 사랑채와 안채 너머의 뒷마당에는 높은 계단 위로 새창열림 나무들 이 심어져 있다 거기에는 장독대도 있고 전망을 즐기는 벤치도 놓여져 있고 그 너머로 땅이 얼면 스케이트장이 되기도 하는 너른 마당과 뒤쪽에 펼쳐진 동산에는 소나무 아카시아 나무 벚나무 밤나무가 줄줄이 서 있다 여기서 소개하는 한 시대의 역사적 그늘과 문화적 기억이 담긴 모눈종이 드로잉과 원고지에 옮겨진 기억 기술 은 한 예술가를 둘러싼 여러 사람들의 복합적인 이야기와 추억 상상을 재구성합니다 그리고 이것을 경험하는 우리는 어떤 정서에 대해 사유하게 됩니다 자연이 가까이 있고 마당에서 철마다 굿판이 열리며 당대의 유명인들이 드나들던 큰 집 한편에는 캐딜락 자동차와 피아노가 있었고 곁에는 친구와 친척 누이들이 함께했습니다 백남준은 이 집에서 일본 고단샤 의 그림책과 마르크스를 읽으며 역사적 혁명을 꿈꾸는 그래서 복합적인 시대적 일상을 고스란히 흡수하던 말 없는 부잣집 막내아들이었다고 합니다 백남준의 가족과 오랜 친구 이경희의 기억을 토대로 한 큰 대문 집 에 관한 자료 인터뷰 영상 등을 펼쳐놓은 석가산 은 인간 백남준에 대한 기억을 나누기 위한 작가의 생일상과 같습니다 석가산 돌을 쌓아 만든 인공산 모양의 정원 양식 당초문 식물 덩굴이나 줄기 모양이 얽힌 무늬 백남준 가족 고혜란이 쓴 원고지 기억구술에서 발췌 사랑아 사랑 사랑 사랑아 낭상 낭상 사랑아 살랑 살랑 사랑아 바닥 바닥 사랑아 달랑 달랑 사랑아 타각 타각 사랑아 팔랑 팔랑 사랑아 바싹 바싹 사랑아 갈랑 갈랑 사랑아 아작 아작 사랑아 담방 담방 사랑아 말랑 말랑 송 이상 에게 백남준 뉴욕 단상 공간 월간 년 월호 인터뷰 비디오 아래 자리한 콜라주 묶음은 년 뇌졸중의 쇼크를 견뎌낸 백남준이 장의 사진 위에 드로잉 하여 유치원 친구 이경희에게 선물한 작품입니다 큰 대문 집 을 둘러싼 새창열림 시간과 공간 의 많은 부분을 나누었던 유년기 백남준과 이경희의 관계는 년 만에 백남준이 고국으로 돌아온 바로 그 시기부터 새로운 신체 예술화로 거듭납니다 백남준은 평소 작품을 무의식으로 만든다 고 여러 번 언급했고 그의 유아기 무의식이 예술적 놀이와 행동으로 지속적으로 분화 발전하는 과정에서 이경희는 목격자이자 유일한 해설자이고 또 동행자로 자리했던 것입니다 연구자 새창열림 김남수 는 백남준이 죽음으로 부터 돌아온 이 시기에 그의 무의식 발현이 최고조에 달한다고 평가합니다 큰 대문 집 을 지나는 상여 사진 여러 인물 비디오 작품 나체 여성 등 각종 이미지에 교차 편집되는 김소월의 진달래꽃 과 산유화 그리고 먼 후일 에서 따온 싯구 자 밥먹자 등 암호와 같은 메모는 그의 신체적 감각에 새겨진 예술적 비밀을 전하는 무의식의 새창열림 비디오 아트 입니다 액션 뮤직 액션 뮤직 은 한국의 젊은 창작자와 문화 생산자들을 초대해 백남준의 액션 뮤직 을 다양한 형태로 펼쳐 보이는 시도입니다 백남준은 전시 관람의 행위 로서 참여 그리고 실제적인 참여와 경험에 의한 직접접촉예술 을 이루어 내고자 했고 이러한 접촉을 통해 이미 존재하는 대상들 사이의 새로운 관계를 찾아내는 과정의 형태가 미디어 아트라고 주장합니다 백남준이 말한 액션 뮤직 을 쉽게 생각해보면 관객이 예술 창작의 주체가 되기를 독려하고 참여자가 콘텐츠의 공동 생산자 되기 입니다 지금은 현존하지 않는 상상의 공간 석가산에서 참여 작가인 서울익스프레스와 은 자신만의 방식으로 백남준의 예술 세계를 끌어들입니다 그리고 백남준의 오랜 조력자였던 전자기술자 이정성과 창신동 주민도슨트는 각자의 역할을 통해 이 여정을 풍부하게 합니다 글로벌 그루브 사운드와 영상을 중심으로 활동하는 서울익스프레스 전유진 홍민기 에게 백남준의 작업들은 늘 새로움을 만들고 미래를 꿈꾸며 그것에 관한 메시지를 던지면서 결국 미래와 소통하는 노력으로 보입니다 그에게는 미래였던 현재 우리에게 남긴 전언으로서 그의 작업을 읽고 해석하는 작업을 통해 백남준이 추구했던 탈장르적이고 주체적인 방식의 개입으로서 액션 뮤직을 시도해 봅니다 작가들은 백남준의 드로잉 꿈 를 대면하고 이 시각적 기호들이 마치 영상을 프레임 단위로 구분하여 표현한 것처럼 시간 기반 의 정보들을 담고 있다고 여겼습니다 그리고 이를 활용하여 움직임 과 음악 이라는 전혀 다른 매체로 해석합니다 음악은 이 드로잉을 일종의 악보 로 해석하여 만들고 움직임은 무보 로 보는 것입니다 총 회로 구성된 워크숍 글로벌 그루브 의 참여자들은 드로잉에 나타난 상징들을 음악이나 무용이 지닌 여러 속성으로 연결하여 감각의 전환과 예술에 대한 적극적인 개입을 시도하게 됩니다 참여자들이 도출한 해석을 바탕으로 작가와 안무가는 음악과 무용을 창작하고 최종적으로 영상의 형태로 완성하여 발표합니다 워크숍 일정 월 일 토 월 일 토 월 일 토 월 일 토 워크숍 시간 오후 시 시 참여인원 강민희 김나율 김보경 김지호 김혜수 남현 노은경 안성민 안재경 유연진 유예은 이가윤 이은희 워크숍 내용 주 백남준과 꿈 알아보기 워밍업 시간 주 그래픽 스코어 기초 익히기 꿈 에서 음의 높이 박자 세기 찾기 무엇이든 악기삼기 주 꿈 를 무보로 삼아 쉬운 몸동작으로 표현해 보기 협업 안무가 조형준 안무 진행 고다희 음악 진행 이예호 텔레비전 아트 텔레비전 아트 는 액션 뮤직 의 두 번째 워크숍으로 백남준이 실제 작품에서 사용했던 텔레비전 기술을 알고 직접 시연하고 전자적 파동을 빚어내는 전자 장치를 체험하는 자리입니다 이 워크숍은 년부터 약 여 년간 백남준의 조력자로서 대규모 비디오 월 작업과 전시 설치를 진행했던 전자기술자 이정성이 진행합니다 이정성은 백남준기념관의 주민 도슨트들과 함께 백남준의 비디오 조각 을 구성하고 구현하는 물리적인 세계를 탐험하기 위한 세 번의 워크숍 자리를 마련했습니다 일련의 과정을 통해 참여자들은 지금까지 텍스트로만 이해했던 백남준기념관에 관한 서사를 새롭게 정비하는 계기를 마련하게 됩니다 년에 개관한 백남준기념관은 주말마다 창신동 주민들이 자발적으로 참여하는 도슨트 프로그램을 운영하고 있습니다 주민 도스트들이 주말마다 제공하는 여러 층위의 정보들을 통해 감상자는 백남준의 예술 세계를 더욱 자유롭게 상상하게 됩니다 워크숍 일정 월 일 월 월 일 월 월 일 월 워크숍 시간 오후 시 시 참여인원 주민 도슨트 김나율 박주현 오수복 유정옥 하남수 워크숍 내용 주 백남준과 이정성이 함께 작업했던 여러 설치 작업의 과정을 시청각 자료로 살펴보기 주 도슨트들이 가장 궁금해하는 한 작품을 골라 눈에 보이는 형상 이면의 기술적인 측면을 살펴보기 주 텔레비전 아트 를 구성하는 물리적 회로도를 눈과 손으로 직접 경험해보기 주고 받기 놀이 주고 받기 놀이 는 조용훈 과 박다함 이 번갈아가며 디제잉하는 믹스 프로젝트입니다 이들의 관심은 주로 아시아 음악에 집중되어 있지만 특정 장르나 스타일에 구애받지 않습니다 기록이 점차 사라지고 있는 희귀한 사운드를 건져 올리기도 하지만 대중적 인기를 얻은 가요나 널리 뿌리 내린 민요에 관심을 갖기도 합니다 독자적인 취향을 중심으로 각 지역에서 활동하는 디제이들의 추천에 적극적으로 귀를 기울입니다 이렇게 수합한 곡들로 두 디제이는 대화를 나누듯 한 곡씩 주고 받으며 약 시간 가량의 믹스를 완성해갑니다 지금까지 한국 일본 태국 홍콩 인도네시아 대만에 이르는 아시아의 여러 지역의 음악을 실어온 주고 받기 놀이 는 이번 버전에서 백남준기념관 주변의 아시아 이주민 공동체에서 착안합니다 백남준기념관이 위치한 창신동에는 네팔 이주민들이 밀집한 네팔 거리 가 형성되어 있고 인접한 광희동에는 우즈베키스탄 카자흐스탄 몽골 등 중앙아시아 거리 가 있으며 또 북쪽의 혜화동에는 필리핀 마켓 이 매주 열립니다 두 디제이는 이 지역을 탐방하며 이주민들로부터 그들이 즐겨듣는 본국 노래를 수집한 뒤 이를 기반으로 현지인들의 도움 혹은 인터넷을 통한 디깅을 이어 새로운 믹스를 완성합니다 한편 이주민들이 운영하거나 자주 찾는 가게들에서 배경음악으로 사용할 수 있도록 완성된 믹스 음원을 배포합니다 신규 음원은 월 일 개관식일 최초 공개되며 관련 자료와 프로젝트 설명문은 전시장에서 열람할 수 있습니다 그래픽 디자인 신덕호 주최 서울시립미술관 관장 백지숙 학예연구부 총괄 백기영 전시 총괄 고원석 교육홍보 총괄 유수기 홍보 김채하 전시 기획 권진 전시 코디네이터 신은주 참여작가 서울익스프레스 이정성 테크니션 백남준 가족 워크숍 프로덕션 프로덕션 콤플렉스 이지원 박봉구 비디오 편집 윤하민 아카이브 및 개막식 촬영 스튜디오 수직수평 홍철기 영문번역 새창열림 김실비 공간디자인 김건태 그래픽 디자인 오진경 협력 백남준 가족 백남준을 기리는 사람들 창신동 주민들,SeMA 백남준기념관,2019-07-20,2019-07-20,SeMA 백남준기념관
131,2019 난지미술창작스튜디오 오픈스튜디오 <2019 SeMA NANJI RESIDENCY OPEN STUDIOOOO>,https://sema.seoul.go.kr/common/imageView?thumbYn=Y&FILE_PATH=%2Fdata%2F2020%2Fmgimg%2Fimg31%2Fkor%2F&FILE_NM=pfile2020_1579241305515.jpg,부대행사,서울시립 난지미술창작스튜디오,2019-11-22,2019-11-22,서울시립 난지미술창작스튜디오
132,2019 난지13기 입주자 기획전 <피니티 미러 Finity Mirror>,https://sema.seoul.go.kr/common/imageView?thumbYn=Y&FILE_PATH=%2Fdata%2F2020%2Fmgimg%2Fimg31%2Fkor%2F&FILE_NM=pfile2020_1579241538650.jpg,부대행사 클로징 행사가 월 일 오픈 스튜디오 와 연계해 진행됩니다,서울시립 난지미술창작스튜디오,2019-11-15,2019-11-15,서울시립 난지미술창작스튜디오
133,[2019 시민큐레이터 기획전시] 《당신의 처음이 제가 아니기를》,https://sema.seoul.go.kr/common/imageView?thumbYn=Y&FILE_PATH=%2Fex%2FEXI01%2F2022%2F&FILE_NM=20220106174429_1ef9f3a821e249b6901a3bb26a9aa34e_c5fd2d47d8b549b1b8980000f4974989,전시 을 전시 하는 전시 구수현 국민대학교 일반대학원 인터미디어아트전공 졸업 국민대학교 미술학부 회화전공 졸업 전시 오늘날의 하얀 방을 그토록 색다르고 멋지게 만드는 것은 무엇인가 디스위켄드룸 서울 막간극 인사미술공간 서울 김기석 숭실대학교 건축학부 실내건축전공 전시 공간의 기호들 하우스 무씨 서울 지속성과 변화 하우스 무씨 서울 박형렬 한국예술종합학교 미술원 조형예술과 예술전문사 졸업 서울예술대학 사진과 졸업 전시 제 회 일우사진상 수상작가전 일우스페이스 서울 숲에 관한 어떤 실험 이마주갤러리 서울 배진일 학력정보 무 전시참여경험 총 번 전시 당신의 처음이 제가 아니기를 창고 서울 강민지 서울대학교 조소과 대학원 졸업 서울대학교 동양화과 영상연합전공 졸업 전시 시 갤러리 도스 서울대학교 조소과 석 박사학위청구전 윤종원 영국 왕립 예술학교 순수미술 조소 전공 석사 졸업 영국 첼시 예술대학교 순수미술 전공 학사 졸업 상명대학교 예술대학 공연학부 무대미술전공 학사 졸업 전시 대안공간 눈 수원 김포 박진아 서울대학교 미술대학 서양화과 졸업 전시 사람들이 조명 아래 모여 있다 합정지구 서울 금호영아티스트 번의 태양과 개의 눈 금호미술관 서울 이정형 홍익대학교 조소과 대학원 졸업 홍익대학교 도예유리과 학사 졸업 전시 인사미술공간 서울 두번의 똑같은 밤은 없다 북서울시립미술관 서울,SeMA 창고,2019-11-06,2019-11-06,SeMA 창고
134,[2019 시민큐레이터 기획전시] 《간식행사를 넘어서: 2010년대 대학 총학생회 아카이브에》,https://sema.seoul.go.kr/common/imageView?thumbYn=Y&FILE_PATH=%2Fex%2FEXI01%2F2022%2F&FILE_NM=20220106153300_b01ecc5af1aa4db8983788d0aec96ec5_4a41e69b7d7e4bfeb7576d3b522df17b,학생회의 위기 라는 말이 나온지 근 년이 지난 이 시점에서 지금 년대의 한국 대학 총학생회는 무엇을 하고 있는지 어떤 상황에 직면해 있는지 그리고 이를 둘러싼 동시대 이슈들을 조명한다 새창열림 퍼포먼스 등 부대행사 간식행사 재현 퍼포먼스 일 강신대 계원예술대학교 현대예술창작과 기획 학사 단체전 시간 밖의 기록자들 부산현대미술관 부산 서희강 홍익대학교 시각디자인과 학사 전시기획 손 프로젝트 변방연극제 명동 삼일로 창고극장 서울 정아람 뉴욕시립대학교 헌터 컬리지 미술대학원 복합매체과 석사 한국예술종합학교 미술원 조형예술과 학사 개인전 나를 위한 말하기 스페이스 윌링앤딜링 서울 단체전 우리는 서로에 의해 허물어진다 공간 힘 부산 조습 경원대학교 대학원 미술대학 회화과 석사 경원대학교 미술대학 회화과 학사 개인전 망 상업화랑 서울 광 갤러리 룩스 서울 광 우민아트센터 청주 오현경 한국예술종합학교 영상원 방송영상과 학사 연출 나리야 각본 원더풀 플라워 정이수 한국예술종합학교 영상원 방송영상과 학사 연출 고요수업 촬영 율리안나 최나래 한국예술종합학교 영상원 방송영상과 학사 연출 오디너리데이 촬영 앨리스 인 네버랜드,SeMA 창고,2019-11-06,2019-11-06,SeMA 창고
135,서울시 tbs교통방송 SeMA 컬렉션 라운지 5호,https://sema.seoul.go.kr/common/imageView?thumbYn=Y&FILE_PATH=%2Fex%2FEXI01%2F2018%2F&FILE_NM=20180802092832_ba3edca6118545c0b0fb162d6dd2072d_835799d23b1f445eaa5afc5391b143b0,서울시립미술관 미술소통프로젝트의 하나로 추진되어온 컬렉션 라운지는 서울시 산하 기관에 라운지를 개설하고 미술관의 소장 작품 중 해당 공간에 적합한 작품을 전시하여 보다 가까이에서 대중들이 작품을 감상할 수 있는 기회를 제공하고자 진행하는 사업이다 컬렉션 라운지 호 교통방송에는 서울을 주제로 한 새창열림 서울풍경 전시가 열리고 있다 서울은 한국 근현대사의 자취 및 끊임없이 변화하는 동시대 생활상을 담고 있는 장소이다 이번 전시에서는 서울에 얽힌 새창열림 시간과 공간 의 흔적을 기록하거나 도심의 모습을 독특한 방식으로 표현한 새창열림 주명덕 새창열림 김민호 새창열림 이득영 의 사진을 만나볼 수 있다 이러한 서울의 다양한 장면들을 포착한 작품들에서 서울을 바라보는 작가 개개인의 독창적인 시선을 발견할 수 있을 것이다 한국사진을 대표하는 주명덕은 년대 서울 곳곳의 소소하고 일상적인 풍경을 포착하여 당대의 사회상을 기록했다 덕수궁 돌담길 새창열림 광화문 서울의 뒷골목 등을 담은 서울 시리즈 는 작가만의 정감 어린 시선으로 바라본 그 당시 서울을 살았던 사람들의 삶이 녹아있는 시대상을 보여준다 김민호는 서울의 랜드마크를 중심으로 촬영한 수십 장의 이미지들을 겹쳐 작품을 완성한다 일례로 서울타워 는 서울타워를 중심으로 돌면서 촬영한 컷의사진을 누적한 작품이다 다시점에서 관찰한 서울타워 주변의 풍경은 여러 장면이 누적되면서 흐릿해지고 본연의 상징성을 잃어간다 마지막으로 이득영은 한강주변의 시설들을 기록하거나 서울 상공에서 한강다리를 촬영하는 방식으로 서울을 보여준다 이번 전시에서는 새창열림 한강변 에 있던 간이매점 곳을 촬영하여 한데 모은 한강 프로젝트 과 한강을 가로지르는 대교 개소를 항공 촬영한 사진 연작 한강 프로젝트 을 선보인다 이 전시는 변화하는 서울의 모습을 서로 다른 작가들의 시선으로 보여준다 이를 통해 서울을 살아가는 사람들이 지나온 시간들을 반추하고 우리 삶의 공간이 가지고 있었던 다양한 모습을 다시 한 번 돌아보는 계기가 될 수 있길 기대한다,서울시 tbs교통방송,2018-05-17,2018-05-17,서울시 tbs교통방송
