,exhibition_name,poster_link,exhibition_description,exhibition_place,start_period,end_period,place
75,[신진미술인 전시지원 프로그램] 전보배 개인전 《noonchinae》,https://sema.seoul.go.kr/common/imageView?thumbYn=Y&FILE_PATH=%2Fex%2FEXI01%2F2021%2F&FILE_NM=20210604112208_6d50d71d2ef14826b48c314a98cf074f_9f79bd7cd1764128a4bf1da79e7469f7,전시소개 신진미술인 전시지원 프로그램의 일환으로 진행되는 전보배 작가의 눈치네 는 김범 작가의 책 눈치 에 등장하는 눈에 보이지 않는 개 눈치 를 사랑해 줄 수 있는 방법에 대해 탐구하는 전시이다 작가는 개와 주인의 흔적을 은유하는 사물조각들을 통해 보이지 않는 존재에 다가가는 방식에 대한 시각적 탐구를 도모한다 감각하는 방식에 대한 연구는 세라믹 드로잉 사진 등 다양한 시각매체를 통해 나타나고 이는 눈치 의 영역을 확장하는 계기가 된다 작가소개 작가 전보배는 일상에서 쉽게 지나치는 것들에 주목함으로써 본인의 생활 반경 속 자리 잡은 미술의 경로를 밝혀내는 작업을 해오고 있다 헛소리나 농담을 떠올리는 등 시간을 거꾸로 들추는 일에서부터 출발하여 모호한 감각을 둘러싼 미술이 지니는 필수불가결한 태도에 대한 탐구를 이어가고 있다 이전 전시로는 마츠모토 준의 사마귀 심은미술관 야외 동시에 엄청난 보호색 용산구 보광동 우사단로 길 이 있다 전시 투어 전시는 한국수출입은행의 후원으로 제작되었습니다 파일은 에서 구동되며 환경에 최적화 되어 있습니다,SeMA 창고,2021-06-03,2021-06-03,SeMA 창고
76,[신진미술인 전시지원 프로그램] 이재석 개인전 《INVENTORY》,https://sema.seoul.go.kr/common/imageView?thumbYn=Y&FILE_PATH=%2Fex%2FEXI01%2F2021%2F&FILE_NM=20210528155707_e39769abd61d423f908d3aad4b810a5e_90b4b8277a624375b6e77b660b5649cb,전시소개 신진미술인 전시지원 프로그램의 일환으로 진행되는 인벤토리 는 시약창고로 쓰였던 창고의 공간적 특징 즉 물품을 정렬해 놓는 공간 자체에 주목한 전시이다 창고의 물리적 공간과 작가가 생각하는 가상의 이미지 저장고 를 연결시켜 가상과 현실이 공존하는 공간의 연출을 시도한다 전시장의 나무 선반들은 그리드 형태의 인벤토리 게임 속 가상의 소지품 창 를 떠올리게 하는데 이는 가상의 차원 이미지를 평면의 캔버스 위에 정렬하는 작가의 작업방식과 연결된다 공간 속에 유형별로 나열된 작품들은 비가시적인 사회의 구조를 시각적으로 표현하려는 작가의 작업의도와 맞물려 하나의 거대한 설치작업으로써 존재하게 된다 작가소개 작가 이재석은 직접 겪은 경험이나 미디어를 통한 사건들을 작업의 소재로 삼는다 대 초반 군대에서 겪었던 일련의 사건들을 통해 시작된 몸 에 대한 고찰은 이후 살덩이 부품 도형과 같은 개념적 요소로 확장 되었으며 작가는 이들 사이의 이질적인 정렬을 통한 새로운 관계 읽기를 시도한다 이러한 개별 요소의 병치를 기반으로 비가시적인 사회의 구조들 수직 수평 정렬 사이의 시각적 조화를 지속적으로 탐구하고 있다 최근 전시로는 경계선 학고재 디자인 프로젝트 스페이스 안팎의 메타포 대전 정렬된 세계 갤러리밈 대전시립미술관 등이 있다 전시 투어 전시는 한국수출입은행의 후원으로 제작되었습니다 파일은 에서 구동되며 환경에 최적화 되어 있습니다,SeMA 창고,2021-06-03,2021-06-03,SeMA 창고
77,SF2021: 판타지 오디세이,https://sema.seoul.go.kr/common/imageView?thumbYn=Y&FILE_PATH=%2Fex%2FEXI01%2F2021%2F&FILE_NM=20210527152113_65b7597adcd7475fac29f3be22630777_ba6b7ae89d7645778af0da65c6dcf9f5,서울시립미술관의 기획전시 판타지 오디세이 는 과학 소설 의 확장하는 장르적 스펙트럼을 배경으로 동시대 미술이 새로운 사유의 가능성을 모색하는 양상을 소개한다 지금 우리는 과거의 가 그려왔던 미래들이 하나둘씩 도착하는 지점에 서있다 그 오래된 미래들이 얼마나 정확히 지금의 현실을 예측했는지는 그다지 중요하지 않다 기후변화 인공지능 자율주행 자동차 등 어쨌든 우리는 그들이 상상하던 세계를 실제로 살고 있다 이 전시는 팬데믹 시대의 혼란스러운 세계와 가상 같은 현실을 탐구하는 한 가지 방식으로 적 상상력의 예술적 실현을 통해 새롭게 설정된 세계관 위에서 현재 속에 야기된 미래들에 접속을 시도한다 이를 위해 전시는 의 시간성이라는 특징을 추출하여 다음과 같이 를 정의한다 이미 있으나 아직 오지 않은 것 혹은 이미 현재 속에 있음에도 불구하고 아직 오지 않은 미래로 존재하므로 판타지의 형태로 말할 수밖에 없는 것 따라서 이 전시는 판타지를 와의 대립항이나 장르적 다양성과 같은 내용 이 아닌 현실을 구성하는 가능조건 으로 바라보고 를 독해하는 동시에 전시를 구성하는 코드로 삼는다 동시대 미술과 마찬가지로 는 재현될 수 없는 것을 드러낸다는 점에서 판타지다 그렇다면 는 현실이 이미 판타지라는 것을 보여주는 유용한 창이 될 수 있다 이 전시는 현실과의 관계 속에서 를 살펴보고 를 창작하고 감상하는 것이 우리에게 가져다줄 수 있는 것 에 대해 이야기하려고 한다 판타지 오디세이 는 열네 명의 국내외 작가를 초대하여 회화 디지털페인팅 사진 영상 사운드 설치 텍스트 등 다양한 매체의 작품을 선보인다 우주 시간 가상현실 디스토피아 포스트휴먼 등 이른바 적 주제와 배경은 전시를 구성하는 개별 작품 속에서 지금 우리의 삶을 지속적으로 갱신하는 새로운 사유의 가능성으로 제시된다 의 특수성은 우리에게 세계를 바라보는 비판적 틀을 제공함으로써 다른 세계를 상상하고 창조하는 동력으로 작용한다 그 세계는 언제나 현실에 발 딛고 새롭게 상정된 세계 다 우리에게 없는 것 잘못되었거나 바로잡고자 하는 것 혹은 영원히 지속하고자 하는 것 등을 선취하는 세계이자 다른 삶의 가능성을 지금 이곳에서 타진하는 장소다 그 세계를 통해 우리가 선취하는 것은 예컨대 인간 중심적 사고방식의 전환 나아가 타자에 대한 성찰이다 과학기술의 발전이 이미 우리의 이해를 넘어 마법과 같은 경지에 이르는 근미래 혹은 이미 여기 와있을지도 모르는 시공간에서 지속적으로 다원화되는 타자들과 우리는 어떻게 공존할 것인가 새로운 형태의 포스트휴먼을 맞이하고 각기 다른 형태의 존재 조건들을 모색하는 과정은 어떻게 일어나고 있는가 낯선 존재들이 조우하여 그려내는 소리 아직 오지 않은 미래가 현재 속에서 부딪치는 소리를 상상하며 지속적으로 현실에 대입해봄으로써 현실을 돌아보는 것이 이 전시의 목적이다 인종 젠더 장애 빈곤과 같은 인류의 문제가 호전과 악화를 거듭하는 역사의 시간 속에서 의 세계가 스스로를 구축함으로써 현실의 시계를 바라건대 종말의 반대 방향을 향해 앞당기고 있다면 바로 그런 점에서 의 세계는 우리 사회의 소외되고 배제된 존재들과 고집스럽게 연대하려는 윤리적 세계다 그 세계가 비록 암울한 폐허일지라도 그 바탕에는 이 삶을 긍정하고 받아들임으로써 궁극적으로 진화하려는 의지가 깔려있기 때문이다 이 전시는 에 담긴 복합적인 사유가 매체 간의 경계를 횡단하여 현대 문화예술 전반으로 확산되는 양상을 살펴보기 위해 서로 다른 두 방향의 이해와 접근을 시도한다 그중 하나는 전시와 프로그램을 통한 매체 실험 이다 즉 시청각 이미지와 텍스트의 결합 교차 순환을 통해 의 다양한 장르적 스펙트럼의 확장가능성을 실험해보는 것이다 전시는 의 장르적 기원인 소설에서 출발하여 시청각 이미지와 텍스트의 결합으로 나아간다 네 명의 소설가는 의 기원과 본질 현재성을 탐구하는 글을 제안하고 이 글은 시청각 이미지와 결합하고 어우러지며 전시 내부에서 를 조망하는 역할을 한다 한편 전시 연계 프로그램에서는 관객 참여를 통해 글과 이미지의 연대 를 실천하는 공동의 창작물을 생산한다 웹사이트를 통해 다수의 창작을 매개하는 실험적 형태로 이루어지는 본 프로그램은 매체 실험을 통해 에 담긴 미래적 사유의 확장가능성을 살펴본다는 전시의 의도를 최종적으로 탐구하는 장이다 전시의 방법론을 구성하는 다른 하나는 적 정서의 탐구 다 미래를 경유하여 언제나 다시 현재로 돌아오는 적 상상력은 단순한 경이감 이상의 복합적인 정서를 불러일으킨다 무엇보다 그것은 현실을 다시 써나갈 수 있는 주체의 삶을 스스로 재구성하는 의지를 품고 있다 가 제시하는 변화의 가능성은 현실에 발 딛고 새롭게 상정된 세계 로부터 유래하기 때문이다 그러므로 가 촉발하는 정서는 삶을 긍정하는 무한한 창조의에너지를 동반한다 결국 이 전시는 현실의 초월이 아닌 지금 이 세계와 존재에 대한 공통의 이해로부터 연대의 가능성이 생겨난다는 믿음에 기초하고 있다 판타지 오디세이 는 우리가 세계를 새롭게 사유할 수 있는 도구로서 를 소개하고 미래를 위한 광대한 서사를 탐구하는 여정의 문을 열어주고자 한다 무한히 펼쳐지는 세계로 통하는 그 문에 들어서는 것은 인류의 존재론적 성찰의 과정이 담긴 한 권의 책을 펼쳐 읽는 것과 같다 각 챕터별로 무한한 이야기를 담은 책 속에는 우주로 떠나는 커다란 배가 등장하고 관객이 탑승하는 순간 새로운 시공간을 탐험하기 위한 항해가 시작된다 에 관한 전시 는 그렇게 관객의 경험과 상상을 통해 비상을 꿈꾸고 궁극적으로 지금 이곳에서 일어나는 모든 것들로 인해서 전시 로 진화할 것이다 영화 스페이스 오디세이 가 뼈다귀의 인류를 우주선에 태워 진화의 길로 항해를 떠났던 미래가 도착한지 년이 지난 지금 판타지 오디세이 는 모든 관객의 발걸음에서 한 편의 환상 모험기 이자 도래할 장소가 펼쳐지는 적 순간이 되기를 기대한다 전시 웹사이트 바로가기,서울시립 북서울미술관,2021-03-23,2021-03-23,서울시립 북서울미술관
78,[SeMA&CGSI 공동주최] 있지만 없었던,https://sema.seoul.go.kr/common/imageView?thumbYn=Y&FILE_PATH=%2Fex%2FEXI01%2F2021%2F&FILE_NM=20210420092846_f5b01503c41042288a140c8ed59a758b_cd0c4892a21c4ed58470ae88290df242,서울시립미술관과 서강대학교 트랜스내셔널인문학연구소 가 공동 주최하고 일제강제동원피해자지원재단과 한국연구재단이 후원하는 있지만 없었던 은 강제노동 현장 속에 흩어진 사진 편지 증언 등 다양한 아카이브를 중심으로 일본 제국 건설 과정에서 벌어진 강제징용의 미시사를 발굴해냅니다 이를 통해 계급 인종 젠더 사회문화적 법제 디아스포라 이주사 등 복잡하게 얽혀있는 노동의 문제들을 가시화하고 있지만 없는듯 굴곡의 삶을 살아가는 노동자들의 이야기를 들려주고자 합니다 전시 아카이브 촬영 주 크로노토프,SeMA 벙커,2021-04-30,2021-04-30,SeMA 벙커
79,시민큐레이터 SeMA 컬렉션 기획전 《어울림의 시작》,https://sema.seoul.go.kr/common/imageView?thumbYn=Y&FILE_PATH=%2Fex%2FEXI01%2F2022%2F&FILE_NM=20220121142112_987ffd8e6286463887de8f7cadb4a37f_d59e212a2190479682bc639b27d217c8,어울림의 시작 은 한옥 건축 구조의 특징을 들여다보고 한옥의 다양한 이면을 살핍니다 이번 전시에서 다루고자 하는 한옥의 건축적 특징은 공간을 나누는 레이어 문 기둥과 기둥 사이의 공간을 나타내는 칸 지붕 아래의 단청 으로 모두 세 가지입니다 이 특징들은 이미 물리적으로 건물 외관에 드러나 있는 요소들이지만 비평적 시선으로 구조물을 주시하다 보면 단단한 구조 뒤에 숨어있는 담론을 들추어낼 수 있습니다 이를 통해 과거의 시대상을 반영하는 지점을 발견하고 시간을 가로질러 동시대까지 걸쳐 있는 주제들을 주목하고자 합니다 앞서 말한 세 가지 특징들은 일련의 과정을 거쳐 시대를 관통하여 젠더 계급 자연과 인간의 관계 라는 동시대의 중요한 이슈로 확장됩니다 이들은 모두 권력의 불균형에 의한 사회문제라는 공통점이 있는데 시간이 지날수록 경계가 더욱 견고해지거나 허물어지기를 반복합니다 널뛰기와 같이 완벽한 대칭을 이루는 것은 아주 찰나에 불과하지만 그럼에도 현대 사회는 이상적인 균형에 가까워지기 위해 많은 충돌과 변화의 시기를 겪어나갑니다 이번 전시는 양극의 균형을 찾아가는 과정 중 하나로 상존하는 권력 문제를 통해 역설적으로 연결과 균형의 실마리를 재고하는 시작점이 되고자 합니다 이 이야기들은 서울시립미술관의 소장품으로 은유되어 한옥의 유기적인 공간 안에서 조화를 이루고 불균형을 넘어 어울림의 순간을 기대하고 경험하는 장이 됩니다 기획 송현호 시민큐레이터 컬렉션 기획전이란 시민큐레이터 컬렉션 기획전은 지난 년간 서울시립미술관이 배출한 시민큐레이터의 지속가능성을 도모하고자 마련되었습니다 본 전시는 서울시립미술관에서 소장품 교육프로그램 운영 후 선발된 시민큐레이터가 삼각산금암미술관으로부터 공간과 예산을 지원받아 서울시립미술관과 삼각산금암미술관의 협력전시로 개최되었습니다 출품작은 모두 서울시립미술관 소장품으로 구성되었습니다 기획자 소개 송현호 대학에서 전시디자인과 융합예술을 전공하고 물리적 공간 안에서 느낄 수 있는 건축적 경험에 관심을 두고 있습니다 예술 작품과 전시 공간 사이의 틈을 비집고 들어 새로운 맥락을 발견하고자 합니다 우천시엔 창문을 열지마시오 임시공간 구시가지 를 기획하고 감각의 제국 서울혁신파크 에 작업으로 참여한 바 있습니다,삼각산금암미술관,2021-04-07,2021-04-07,삼각산금암미술관
80,[신진미술인 전시지원 프로그램] 이소라 기획전 《Ground X》,https://sema.seoul.go.kr/common/imageView?thumbYn=Y&FILE_PATH=%2Fex%2FEXI01%2F2021%2F&FILE_NM=20210428181019_1c1d51ef2e4f4e0882930dff6523b004_78f7296ad234408087d8d3f26257fd4b,신진미술인 전시지원 프로그램 전시 소개 신진미술인 전시지원 프로그램의 일환으로 진행되는 이소라 기획자의 는 인간과 생명체들의 연속된 서식지에 관한 전시이다 전시는 생명체들에게 서식지를 제공하고 삶을 유지할 수 있게 해주는 환경을 들여다본다 여기서 환경이란 물 불 바람 등의 자연적 의미의 환경과 우리를 둘러 싼 미디어 환경을 아우르는 용어로 사용한다 전시는 자연과 미디어 환경의 분리를 넘어 서로 다른 것들이 충돌하고 포개지는 그라운드를 생성하고자 한다 그라운드는 자연과 미디어 환경의 상호작용 속에서 이질적인 것들이 교차하는 임시적 지대를 제안한다 더불어 엑스 로 명명될 개개인의 그라운드를 호명하는 자리를 열어주고자 한다 를 시도하는 작품들은 생명의 터전인 자연 환경과 비트 의 세계를 떠받치는 미디어 환경 그리고 그 틈을 부유하는 포괄적 의미의 서식지를 보여준다 김원화는 개인의 작업실을 스캐닝하고 가상공간으로 전환하면서 현실을 확장하고 새로운 서식 환경을 제시한다 이수진은 사진 새창열림 퍼포먼스 내레이션 등이 포함된 사이언스 픽션 영화와 오브제 등을 통해 현실 세계와 현대사회의 가치상실 그리고 초현실적인 중간세계를 넘나들며 다채로운 공간을 선보인다 전미래는 흙의 기운이 느껴지는 농축된 와인의 향과 솟구치거나 가라앉은 파동 사이를 경유하며 언어화할 수 없었던 사이공간의 리듬을 시각화한다 전시에 참여한 작가들은 우리를 인간과 그 외 생명체들 자연과 문화 등이 유연하게 맞닿는 연속적 사고의 그라운드로 초대하여 전과는 다른 삶의 태도를 고민하게 한다 기획자 소개 이소라 는 미술의 언어와 현실세계가 맞닿는 지점에 관심을 두고 두 세계를 잇는 매개자로서 연구를 지속하고 있다 년 공공미술 프로젝트인 팀황학동에서 리서처로 활동하며 공공저널 팀황학동 케이크 갤러리 에 기고했고 년부터 년까지 문화역서울 에 재직했다 년 임영주 장은의 작가의 인전 공교롭게도 회화 갤러리 플래닛 서울 을 기획했고 년에는 구글 아트프로젝트 원고 에디팅을 진행했다 년도에 파브아트웍스를 설립하여 연결고리 대외협력전 서울로미디어캔버스 서울 에서 진행한 제 회 글로벌 공모 와 우수작 전시 온라인 기획 등 다수의 프로젝트에 참여했다 참여작가 소개 김원화 는 동시대 자본주의 시스템 내 구성원들의 소외에 관심을 가지고 이들의 심리적 극복을 가상현실에서 찾고자 한다 최근 인공지능 관리 사회의 등장을 바라보며 노동으로부터 소외된 인간이 아닌 이것으로부터 해방된 인간의 삶이라는 유토피아적 상상을 개인의 확장된 가상공간에서 구현하는 작업에 집중하고 있다 주요 개인전으로는 방으로 첨벙 아트스페이스 그로브 원룸 어드벤처 세운 콜론비아츠 이 있으며 단체전으로는 현대 세종 모터갤러리 김과현씨 포스트 코로나시대의 미술 오산시립미술관 기계 신의 탄생 등이 있다 이수진 은 도시화와 산업화 이후 빠르게 소외되고 소멸되는 가치에 천착하여 새로운 생성변화와 가치전도를 위한 미시적인 상상이 구현 가능한 다양한 감각적 실험들을 관객 참여형 퍼포먼스 공간설치 그리고 영상작업 등으로 표현해오고 있다 주요 개인전 먼나무 숲에서 갈대와 소나무가 돌에 뿌리를 내리고 돌과 함께 산다 경기도미술관 프로젝트 갤러리 외 기획단체전 스페인무빙이미지페스티벌 마드리드 스페인 국제다큐멘터리영화제 고양 이땅의 미래 아키요시다이 국제아트빌리지 야마구치현 일본 등에 참여하였다 전미래 는 역사와 신화를 솔기질 함과 동시 감각을 기반으로 예술의 가치탐구를 하고 있다 년 파리 국립고등미술학교를 졸업하고 년 포스트디플롬을 마쳤다 발효의 연식술 미메시스 미술관 파주 등 네 번의 개인전과 레퓨지아 새창열림 대안공간 루프 서울 국립현대미술관 과천 새창열림 백남준 아트센터 용인 등 단체전에 참여했으며 년 경기창작센터와 년 세마 난지미술창작스튜디오 레지던시에 참여했다 년 한강예술프로젝트 한강 예술로 멈춰 흐르다 에서 수행성 관련 퍼포먼스를 선보였으며 년 국립현대무용단 이미 아직 공연에 새창열림 시각예술 관련분야 참여와 년 자아 예술가 엄마 책 등 다수의 프로젝트에 참여한 바 있다,SeMA 창고,2021-05-04,2021-05-04,SeMA 창고
81,대기실 프로젝트 #2 <사랑을 위한 준비운동>,https://sema.seoul.go.kr/common/imageView?thumbYn=Y&FILE_PATH=%2Fex%2FEXI01%2F2021%2F&FILE_NM=20210330130743_181fae718838456b80204d9ebcaa41a3_c975bc9536dd47838ad8e6ac3d4e64d4,사랑에도 배움과 연습이 필요합니다 흔히 우리는 사랑을 특정한 관계에서 발현되는 특별하고 낭만적인 감정이라 여기지만 사랑은 세계를 이해하고 관계를 맺는 아주 일상적인 태도이자 삶을 향한 내적 동기이기도 합니다 전자가 대상에 의해 형성되는 감정이라면 후자는 우리의 의지와 선택으로 행하는 일종의 능동적인 활동이 됩니다 한 독일의 사회심리학자 역시도 사랑은 빠져드는 것 이 아니라 참여하는 것 이라 말하며 제대로 사랑하기 위해서는 사랑에도 교육이 필요하다 고 말했습니다 그러니까 우리는 누구나 사랑을 할 수 있다고 믿지만 정작 다른 세계를 이해하고 어떻게 관계를 맺어야 하는지 그 방법을 처음부터 아는 것은 아닙니다 사랑에도 준비 운동이 필요합니다 우리는 그 어느 때보다 사랑이 필요한 시대를 살아가고 있습니다 맘충 틀딱 김치녀 등과 같은 혐오 표현은 더 이상 특정 집단만이 아닌 언론이나 대화에서도 쉽게 접할 수 있는 일상의 언어가 되었습니다 년 말 시작된 코로나 를 통해 경험한 우리 사회의 구분 짓기와 배제의 이슈 등은 오랜 시간에 걸쳐 공고해진 편견과 억압의 구조를 낱낱이 드러내 보였습니다 실제로 한 연구 결과에 따르면 코로나 발병 이후 특정 집단을 향한 혐오 표현이 증가했으며 이는 재난 상황 속에서 그 책임과 공포를 특정 집단을 향한 혐오로 발산하고 정당화하고 있음을 보여 줍니다 이처럼 집단화된 양태는 혐오와 차별이 그 사회와 공동체에 내재된 오래된 관습과 편견임을 방증합니다 따라서 이와 같은 문제를 개인의 것으로 치부하기보다는 사회 전체가 숙고하고 함께 조정해야 할 인식으로 받아들일 필요가 있습니다 대기실 프로젝트 사랑을 위한 준비운동 은 이처럼 한국 사회에 존재하는 다층적인 차별과 혐오 구분 짓기에서 파생되는 일상의 폭력에 맞서는 의지와 동력으로서 능동적이고 의도적인 사랑의 실천에 주목합니다 사랑은 그것이 특정 대상을 향한 에로스적인 것이든 광의의 인류애든 간에 타자와의 만남에서 서로의 차이를 발견하고 나아가 타자의 경험을 자신에게 포개어 세계를 탐색하는 전도의 경험을 유발합니다 이 과정은 차이에 대한 이해를 통해 앎을 가능하게 하고 완전히 새로운 세계를 접할 수 있게 합니다 따라서 사랑을 위한 준비 운동 은 우리의 일상에서 낯선 것 다른 것 비정상적이라고 여겨졌던 것과 대면하고 그런 차이의 이해를 가능하게 하는 동력이자 행동과 사유의 변화를 이끄는 의도적인 배움의 실천으로서 사랑을 제안합니다 여기서 사랑은 한낱 개인의 영역에 머물거나 몇몇 예외적인 상황에서 실천할 수 있는 것이 아니라 우리 공동체와 사회 전체가 마주한 일상 속에서 실체화되는 의도적인 배움의 실천입니다 일상에서 시작되는 작은 사랑의 실천이 우리의 말과 몸에 체화되고 내재된 고정 관념을 재고하고 나아가 해체하는 동력이 될 것이라는 믿음으로 사랑을 연습해 보는 시간을 마련했습니다 월 일부터 일까지 주 동안 서울시립 남서울미술관에서 펼쳐질 강연 체조 허밍 새창열림 퍼포먼스 워크숍 등 말과 몸짓을 중심으로 한 다양한 배움과 실천의 활동은 서로를 억압하고 구분 지었던 입과 몸으로부터 벗어나 우리를 사랑의 상태로 진입할 수 있도록 도울 것이라 기대합니다 프로그램 참여를 원하시면 다음의 링크 사랑을위한준비운동 참여신청 사랑을위한준비운동 참여신청 를 통해 신청하실 수 있습니다 프로그램 참여 외에도 전시 관람이 가능합니다 전시 관람은 서울시 사전예약시스템 과 현장 접수로 가능합니다,서울시립 남서울미술관,2021-05-04,2021-05-04,서울시립 남서울미술관
